{
  "messages": [
    {
      "role": "assistant",
      "content": "Two structural assumptions are doing load-bearing work in the proof: (1) the dataset is observational, (2) the unobserved-confounder variable Z is bounded. If either fails, the conclusion collapses."
    }
  ],
  "tool_events": [],
  "usage": {
    "prompt_tokens": 2150,
    "completion_tokens": 410,
    "total_tokens": 2560,
    "cost_usd": 0.0287
  },
  "finish_reason": "stop",
  "structured_output": {
    "text": "Two structural assumptions are doing load-bearing work in the proof: (1) the dataset is observational, (2) the unobserved-confounder variable Z is bounded. If either fails, the conclusion collapses.",
    "direct_requests": [
      {
        "target": "researcher",
        "type": "verification",
        "content": "Is the dataset observational? Methods section reference, please."
      }
    ]
  },
  "raw": {"id": "chatcmpl-fake-001", "model": "redacted"},
  "error": null
}
