{
  "messages": [
    {
      "role": "assistant",
      "content": "Round surfaced two competing hypotheses (selection bias vs. unobserved confounder). The researcher's verification rules out selection bias; critic's challenge on the bounded-confounder assumption is unresolved. Recommend continuing to give the critic and engineer a chance to stress-test the bound."
    }
  ],
  "tool_events": [],
  "usage": {
    "prompt_tokens": 3120,
    "completion_tokens": 340,
    "total_tokens": 3460,
    "cost_usd": 0.052
  },
  "finish_reason": "stop",
  "structured_output": {
    "next_action": "continue",
    "rationale": "Selection bias ruled out; bounded-confounder claim not yet stress-tested.",
    "confidence": 0.62,
    "focus": "Adjudicate the bound on unobserved confounder Z; engineer to weigh implementation implications.",
    "next_agents": ["critic", "engineer"],
    "resolved_disagreements": [
      {
        "topic": "Whether the dataset is observational",
        "resolution": "Confirmed observational cohort (n=4,213); cited methods section.",
        "agents_involved": ["logician", "researcher"]
      }
    ],
    "unresolved_disagreements": [
      {
        "topic": "Bound on unobserved confounder Z",
        "positions": [
          {"agent": "logician", "claim": "Bound is structural; effect survives any plausible Z."},
          {"agent": "critic", "claim": "Bound is unjustified without sensitivity analysis."}
        ],
        "blocker": false
      }
    ]
  },
  "raw": {
    "id": "msg-anthropic-redacted-001",
    "model": "redacted",
    "stop_reason": "end_turn"
  },
  "error": null
}
